id,title,type,description,release_year,age_certification,runtime,genres,imdb_id,imdb_score
tm96700,Candleshoe,MOVIE,"When ex-con artist Harry claims that a secret treasure is hidden inside Candleshoe, an English estate, he creates an elaborate plan to find and steal the prize. By convincing a girl named Casey to impersonate the estate owner's long-lost granddaughter, Harry hopes to uncover the treasure's location. But when Casey has a change of heart, she must follow the clues and find the treasure, in order to save Candleshoe and stop Harry before it is too late.",1977,PG,97,"['family', 'comedy', 'drama']",tt0075807,6.7
tm240623,Mary Poppins Returns,MOVIE,"Mary Poppins returns to the Banks family and helps them evade grave dangers by taking them on magical, musical adventures.",2018,PG,131,"['fantasy', 'comedy', 'family', 'animation']",tt5028496,6.7
tm230984,Ferdinand,MOVIE,"Ferdinand, a little bull, prefers sitting quietly under a cork tree just smelling the flowers versus jumping around, snorting, and butting heads with other bulls. As Ferdinand grows big and strong, his temperament remains mellow, but one day five men come to choose the ""biggest, fastest, roughest bull"" for the bullfights in Madrid and Ferdinand is mistakenly chosen.  Based on the classic 1936 children's book by Munro Leaf.",2017,PG,115,"['comedy', 'drama', 'family', 'fantasy', 'animation']",tt3411444,6.7
tm1064162,Stuntman,MOVIE,"This documentary follows legendary stuntman Eddie Braun as he attempts one of the most dangerous stunts in history. Contemplating retirement and having survived over three decades of hellacious car crashes, explosions, high falls, and death-defying leaps, Eddie decides to complete what his childhood hero never finished -- the infamous Snake River Canyon rocket jump -- an audacious televised event that almost killed the man that inspired Eddie to become a stuntman, Evel Knievel.",2018,PG-13,87,['documentation'],tt6539830,6.7
tm105031,James and the Giant Peach,MOVIE,"When the young orphan boy James spills a magic bag of crocodile tongues, he finds himself in possession of a giant peach that flies him away to strange lands.",1996,PG,79,"['fantasy', 'animation', 'family']",tt0116683,6.7
tm77376,Going to the Mat,MOVIE,"Jace Newfield has a problem. Besides being blind and being the new kid at school, his problem is that the kids at his new school thinks he's a jerk. Jace has to find a way to be accepted into his new school. Joining the wrestling team just might work.",2004,,96,"['drama', 'family', 'sport']",tt0399104,6.7
tm41096,The Absent-Minded Professor,MOVIE,"Bumbling professor Ned Brainard accidentally invents flying rubber, or ""Flubber"", an incredible material that gains energy every time it strikes a hard surface. It allows for the invention of shoes that can allow jumps of amazing heights and enables a modified Model-T to fly. Unfortunately, no one is interested in the material except for Alonzo Hawk, a corrupt businessman who wants to steal the material for himself.",1961,G,96,"['scifi', 'sport', 'comedy', 'family']",tt0054594,6.7
tm419118,Expedition China,MOVIE,"Expedition China invites you on location in some of the world's most intense, hard-to-reach environments with the filmmakers of Disneynature's big-screen adventure Born in China.",2017,G,78,['documentation'],tt8064392,6.7
ts12215,Bonkers,SHOW,"Bonkers is an animated American television series that aired from September 4, 1993 to August 24, 1995 in first-run syndication. The syndicated run was available both separately, and as part of The Disney Afternoon. The show was last seen on Toon Disney, but was taken off the schedule in late 2004.",1993,TV-Y7,25,"['comedy', 'western', 'action', 'fantasy', 'scifi', 'animation', 'crime', 'family']",tt0213334,6.7
tm51489,Don't Look Under the Bed,MOVIE,A girl calls on her brother's imaginary friend to banish a mischievous boogeyman who has framed her for his pranks.,1999,PG,93,"['horror', 'family', 'fantasy', 'comedy']",tt0208101,6.7
tm543420,How Dogs Got Their Shapes,MOVIE,"With many breeds and countless variations, canines are one of the most diverse species on Earth. From ears to tails, coats to paws, every part of their bodies is uniquely structured to serve a purpose. How Dogs Got Their Shapes shines a light on a variety of canine shapes to explain how each aspect plays a pivotal role in the evolution, history, and behavior of distinct dog breeds.",2016,,44,['documentation'],tt5648768,6.7
ts105720,Bia,SHOW,"Bia loves to draw and paint. She and her two best friends spend time at Fundom, a place where they and influencers like to show off their talents. On the other hand, LAIX is a network in which its CEO only wants fame and money.",2019,TV-G,37,"['drama', 'family', 'music', 'romance', 'action', 'comedy']",tt9168904,6.7
ts287032,The Right Stuff,SHOW,"At the height of the Cold War, newly formed NASA selects seven of the military’s best test pilots to become astronauts. Competing to be the first in space, these men achieve the extraordinary, inspiring the world to turn towards a new horizon of ambition and hope.",2020,TV-14,44,"['drama', 'history']",tt7423322,6.7
tm1047333,Shark Beach With Chris Hemsworth,MOVIE,Chris Hemsworth has a real passion for sharks. The Hollywood star talks to experts to find out more about the apex predators of the oceans.,2021,PG-13,44,['documentation'],tt12833014,6.6
tm305230,Tangled: Before Ever After,MOVIE,"Rapunzel grapples with the responsibilities of being a princess and the overprotective ways of her father. While she wholeheartedly loves Eugene, Rapunzel does not share his immediate desire to get married and settle down within the castle walls. Determined to live life on her own terms, she and her tough-as-nails Lady-in-Waiting Cassandra embark on a secret adventure where they encounter mystical rocks that magically cause Rapunzel's long blonde hair to grow back. Impossible to break and difficult to hide, Rapunzel must learn to embrace her hair and all that it represents.",2017,G,55,"['comedy', 'fantasy', 'action', 'family', 'animation']",tt6874966,6.6
tm119319,The Happiest Millionaire,MOVIE,"A happy and unbelievably lucky young Irish immigrant, John Lawless, lands a job as the butler of an unconventional millionaire, Biddle. His daughter, Cordelia Drexel Biddle, tires of the unusual antics of her father--especially since the nice young men around town all fear him. Wouldn't you fear a father-in-law that keeps alligators for pets and teaches boxing at his daily Bible classes?",1967,G,172,"['comedy', 'drama', 'romance', 'family']",tt0061749,6.6
tm183361,The Moon-Spinners,MOVIE,"Young English girl Nikky and her aunt arrive at the Moon-Spinners, a hotel on Crete, to a less than enthusiastic welcome. The coolness of the owner is only out-done by the surliness of her brother Stratos, recently back from London. But then there is nice English lad Mark to make friends with, at least until Stratos and his pal take a shot at him one night. When Nikky helps him hide she finds the Greeks are after her too.",1964,PG,118,"['family', 'thriller', 'romance']",tt0058371,6.6
tm59862,The Story of Robin Hood and His Merrie Men,MOVIE,"Young Robin Hood, in love with Maid Marian, enters an archery contest with his father at the King's palace. On the way home his father is murdered by henchmen of Prince John. Robin takes up the life of an outlaw, gathering together his band of merry men with him in Sherwood Forest, to avenge his father's death and to help the people of the land that Prince John are over taxing.",1952,,83,"['action', 'family']",tt0045197,6.6
tm57184,The Parent Trap,MOVIE,"Hallie Parker and Annie James are identical twins separated at a young age because of their parents' divorce. Unknowingly to their parents, the girls are sent to the same summer camp where they meet, discover the truth about themselves, and then plot with each other to switch places.",1998,PG,128,"['comedy', 'family', 'drama', 'romance']",tt0120783,6.6
tm1064170,Shark Gangs,MOVIE,Scientists have discovered and investigate the reason behind the behavior of sharks swimming around in gangs even though they are viewed as solitary predators.,2021,PG-13,44,['documentation'],tt14811278,6.6
tm448006,Mission to the Sun,MOVIE,"A look at NASA's Parker Solar Probe, which launched its mission to explore the sun in August 2018.",2018,PG,44,['documentation'],tt9165688,6.6
tm11036,Heavyweights,MOVIE,"Camp Hope is a summer retreat for overweight boys run by a kindly couple who make the campers feel comfortable with their extra pounds. But when tyrannical fitness guru Tony buys the camp, he puts the kids on a cruel regimen that goes too far. Sick of the endless weeks of ""all work and no play,"" the kids stage a coup and reclaim their summer of fun.",1995,PG,100,"['comedy', 'drama', 'family', 'sport']",tt0110006,6.6
ts44984,Descendants: Wicked World,SHOW,"After Ben's coronation in Descendants, the villain kids Mal, Evie, Carlos and Jay settle in at being good while their villainous parents are still roaming the Isle of the Lost. The story goes deeper at the arrival of new villain kids, Freddie (Dr. Facilier's daughter), CJ (Captain Hook's daughter) and Zevon (Yzma's son).",2015,TV-G,6,"['scifi', 'family', 'fantasy', 'romance', 'animation', 'comedy']",tt4951098,6.6
tm38375,X-Men: The Last Stand,MOVIE,"When a cure is found to treat mutations, lines are drawn amongst the X-Men—led by Professor Charles Xavier—and the Brotherhood, a band of powerful mutants organised under Xavier's former ally, Magneto.",2006,PG-13,104,"['thriller', 'action', 'scifi', 'documentation']",tt0376994,6.6
ts21763,That's So Raven,SHOW,"No ordinary teenager; Raven Baxter can see glimpses of the future! Watch her schemes and misadventures as she enlists the help of friends, including best friends Eddie and Chelsea, to change life's little outcomes. Raven's younger brother, Cory, is obsessed with money and creates get-rich-quick schemes to try to earn cash.",2003,TV-G,22,"['scifi', 'comedy', 'family', 'fantasy']",tt0300865,6.6
tm5,Star Wars: Episode II - Attack of the Clones,MOVIE,"Following an assassination attempt on Senator Padmé Amidala, Jedi Knights Anakin Skywalker and Obi-Wan Kenobi investigate a mysterious plot that could change the galaxy forever.",2002,PG,142,"['scifi', 'fantasy', 'action']",tt0121765,6.6
ts15388,American Dragon: Jake Long,SHOW,"American Dragon is a coming of age comedy-action series about Jake Long, a 13-year-old Asian-American boy who strives to find balance in his life as a skateboard-grinding, New York 'tween while learning to master his mystical powers (in his secret identity) as the American Dragon, the protector and guardian of all magical creatures secretly living amidst the human world.",2005,TV-G,21,"['comedy', 'action', 'animation', 'family', 'fantasy']",tt0429305,6.6
tm423725,Maleficent: Mistress of Evil,MOVIE,"Maleficent and her goddaughter Aurora begin to question the complex family ties that bind them as they are pulled in different directions by impending nuptials, unexpected allies, and dark new forces at play.",2019,PG,119,"['fantasy', 'family']",tt4777008,6.6
ts41316,Lab Rats: Elite Force,SHOW,"In a bustling metropolis after the Mighty Med hospital is destroyed by a band of unknown super-villains, Adam and Leo volunteer to oversee the students at Davenport's Bionic Academy. Kaz, Oliver and Skylar join forces with Chase and Bree to form a powerful elite force that combines bionic heroes and superheroes. Together, they vow to track down the villains and keep the world safe.",2016,TV-Y7,23,"['scifi', 'comedy', 'drama', 'family']",tt5118450,6.6
tm95184,Davy Crockett and the River Pirates,MOVIE,"Davy Crockett and his sidekick Georgie compete against boastful Mike Fink (""King of the River"") in a boat race to New Orleans. Later, Davy and Georgie, allied with Fink, battle a group of river pirates trying to pass themselves off as Native Americans.",1956,G,81,"['western', 'comedy', 'drama', 'family']",tt0049125,6.6
tm470101,Dolphin Reef,MOVIE,"Disneynature dives under the sea to frolic with some of the planet's most engaging animals: dolphins. Echo is a young bottlenose dolphin who can't quite decide if it's time to grow up and take on new responsibilities-or give in to his silly side and just have fun. Dolphin society is tricky, and the coral reef that Echo and his family call home depends on all of its inhabitants to keep it healthy. But with humpback whales, orcas, sea turtles and cuttlefish seemingly begging for his attention, Echo has a tough time resisting all that the ocean has to offer.",2019,G,77,"['documentation', 'family']",tt10055028,6.6
tm116982,Tuck Everlasting,MOVIE,"Teenager Winnie Foster is growing up in a small rural town in 1914 with her loving but overprotective parents, but Winnie longs for a life of greater freedom and adventure.",2002,PG,90,"['drama', 'fantasy', 'romance', 'family']",tt0283084,6.6
ts21685,Lizzie McGuire,SHOW,"Lizzie McGuire is all about the ordinary and not-so-ordinary adventures of a junior high student and her two best friends as they try to deal with the ups and downs of school, popularity, boys, parents, a bratty little brother--just life in general. And if Lizzie leaves anything unsaid, you can bet that her cartoon alter ego will say it for her!",2001,TV-PG,22,"['comedy', 'drama', 'family']",tt0273366,6.6
ts21940,Kick Buttowski: Suburban Daredevil,SHOW,"Kick Buttowski: Suburban Daredevil is an Emmy Nominated animated television series created by animator Sandro Corsaro, about a young boy named Clarence ""Kick"" Buttowski, who aspires to become the world's greatest daredevil. It became the fourth Disney XD original series and the first animated series. The show premiered on February 13, 2010, with two episodes airing the first day. Also the series premiered on Disney Channel Asia on May 28, 2010 There are two 11-minute segments per show. The show uses Toon Boom Animation software. There are also some 3D-animated elements. The series is executive-produced and directed by Chris Savino. and Sandro Corsaro. Many of the characters and situations were based on the Corsaro's childhood growing up in Stoneham, Massachusetts.",2010,TV-Y7,23,"['action', 'comedy', 'family', 'thriller', 'animation']",tt1600757,6.6
tm79554,Those Calloways,MOVIE,"Story of Cam Calloway and his family, who live in a densely wooded area in New England. Cam dreams of building a sanctuary for the geese that fly over the area each year, and he tries several schemes to buy a nearby lake for this santuary. He is thwarted at every attempt, it seems; he and his son try to get enough furs from their trapping venture to get the money, but the bottom falls out of the fur market. He uses the little money they get for a down payment on the lake, thereby losing their house when he can't make the mortgage payment. They move to the lake, where their friends help them build a cabin. A salesman stops in town, and tries to get the people to sell their land for a tourist venture; Cam is outraged at his tactics and takes desperate measures after he himself is tricked.",1965,PG,131,"['drama', 'family']",tt0059796,6.6
tm113590,Iron Will,MOVIE,"When Will Stoneman's father dies, he is left alone to take care of his mother and their land. Needing money to maintain it, he decides to join a cross country dogsled race. This race will require days of racing for long hours, through harsh weather and terrain. This young man will need a lot of courage and a strong will to complete this race.",1994,PG,108,"['family', 'action']",tt0110157,6.6
ts225712,Jungle Animal Rescue,SHOW,"A land of elephants, tigers, leopards and bears, India is one of the most biodiverse countries on earth. But it's also home to 1.3 billion people who increasingly compete with wild animals for living space. Now, a dedicated team of conservationists and vets are on a mission to rescue animals in distress and find a way for India's people and wildlife to coexist in harmony.",2020,TV-PG,44,['documentation'],tt12690880,6.6
ts79038,Muppet Babies,SHOW,"The reimagined playroom antics and wacky adventures of the young Kermit the Frog, Piggy, Fozzie Bear, Gonzo, Animal, Summer Penguin, and Miss Nanny.",2018,TV-Y,22,"['comedy', 'animation', 'scifi', 'fantasy', 'family']",tt6337766,6.6
ts75597,Marvel's Ant-Man,SHOW,"Follow Scott Lang as Ant-Man, dealing with everything from super villains to miniature alien invasions (and occasionally helping Cassie with her homework). Along with The Wasp and Hank Pym, Ant-Man protects the world one inch at a time.",2017,,1,"['action', 'comedy', 'family', 'scifi', 'animation']",tt7249258,6.6
tm96866,Prince of Persia: The Sands of Time,MOVIE,"A rogue prince reluctantly joins forces with a mysterious princess and together, they race against dark forces to safeguard an ancient dagger capable of releasing the Sands of Time – gift from the gods that can reverse time and allow its possessor to rule the world.",2010,PG-13,116,"['fantasy', 'scifi', 'action']",tt0473075,6.6
ts22023,Hercules,SHOW,Follow Herc's many labors during the years he spent training on how to be a hero under the tutelage of satyr Phil. Many of the Olympian Gods and Goddesses pay visit to the young hero-to-be and help or hinder him in his new adventures.,1998,TV-Y,23,"['comedy', 'action', 'animation', 'family', 'fantasy']",tt0138967,6.6
tm42549,Halloweentown,MOVIE,"On her 13th birthday, Marnie learns she's a witch, discovers a secret portal, and is transported to Halloweentown — a magical place where ghosts and ghouls, witches and werewolves live apart from the human world. But she soon finds herself battling wicked warlocks, evil curses, and endless surprises.",1998,G,84,"['comedy', 'family', 'fantasy']",tt0173886,6.6
tm42665,Recess: School's Out,MOVIE,"It's the most exciting time of year at Third Street Elementary-- the end of the School Year! But boredom quickly sets in for protagonist TJ Detweiler, as his friends are headed for Summer Camp. One day, while passing by the school on his bike, he notices a green glow coming from the school's auditorium. This is the work of the insidious ex-principal of Third Street, Phillium Benedict and his gang of ninjas and secret service look-alikes! Benedict is planning to get rid of Summer Vacation using his newly-acquired Tractor Beam, which he stole from the US Military Base in an effort to raise US Test Scores, and it's up to the Recess Gang to stop him!",2001,G,82,"['scifi', 'comedy', 'family', 'animation']",tt0266889,6.6
ts20422,Lab Rats,SHOW,"Leo is an ordinary teenager who has moved into a high-tech ""smart'' house with his mother, inventor stepfather and Eddy, the computer that runs the house. Leo's life becomes less ordinary when, one day, he discovers a secret underground lab that houses three experiments: superhuman teenagers. The trio -- Adam, the strong one, Bree, the fast one and Chase, the smart one -- convinces Leo and his parents to let them leave their lab and join Leo at school, where they try to fit in while having to manage their unpredictable bionic strengths. As Leo figures out a way to keep his new pals' bionic abilities a secret, they help him build self-confidence.",2012,TV-Y7,24,"['scifi', 'action', 'comedy', 'drama', 'family']",tt1991564,6.6
tm72333,John Carter,MOVIE,"John Carter is a war-weary, former military captain who's inexplicably transported to the mysterious and exotic planet of Barsoom (Mars) and reluctantly becomes embroiled in an epic conflict. It's a world on the brink of collapse, and Carter rediscovers his humanity when he realizes the survival of Barsoom and its people rests in his hands.",2012,PG-13,132,"['scifi', 'action', 'european']",tt0401729,6.6
tm190870,Cinderella,MOVIE,"Cinderella chafes under the cruelty of her wicked stepmother and her evil stepsisters, until her Fairy Godmother steps in to change her life for one unforgettable night. At the ball, she falls for handsome Prince Christopher, whose parents, King Maximillian and Queen Constantina, are anxious for him to find a suitable paramour.",1997,G,88,"['fantasy', 'romance', 'family']",tt0128996,6.6
tm173805,Pirates of the Caribbean: On Stranger Tides,MOVIE,"Captain Jack Sparrow crosses paths with a woman from his past, and he's not sure if it's love -- or if she's a ruthless con artist who's using him to find the fabled Fountain of Youth. When she forces him aboard the Queen Anne's Revenge, the ship of the formidable pirate Blackbeard, Jack finds himself on an unexpected adventure in which he doesn't know who to fear more: Blackbeard or the woman from his past.",2011,PG-13,137,"['fantasy', 'action']",tt1298650,6.6
ts10806,The Emperor's New School,SHOW,"It's about Kuzco, a self-centered and spoiled teen who must survive the trials of Incan public school and pass all of his classes so that he can officially become Emperor. His friend Malina keeps his attitude in check, while the evil Yzma (cleverly disguised as Principal Amzy) and her dim-witted sidekick Kronk are out to make sure Kuzco fails.",2006,TV-Y,23,"['comedy', 'family', 'fantasy', 'animation']",tt0465327,6.6
tm45667,Oliver & Company,MOVIE,"This animated take on Oliver Twist re-imagines Oliver as an adorable orphaned kitten who struggles to survive in New York City and falls in with a band of canine criminals led by an evil human. First, Oliver meets Dodger, a carefree mutt with street savoir faire. But when Oliver meets wealthy Jenny on one of the gang's thieving missions, his life changes forever.",1988,G,74,"['animation', 'comedy', 'family']",tt0095776,6.6
tm118766,Winnie the Pooh: A Very Merry Pooh Year,MOVIE,It's Christmastime in the Hundred Acre Wood and all of the gang is getting ready with presents and decorations. The gang makes a list of what they want for Christmas and send it to Santa Claus - except that Pooh forgot to ask for something. So he heads out to retrieve the letter and get it to Santa by Christmas...which happens to be tomorrow!,2002,G,65,"['animation', 'comedy', 'drama', 'family', 'fantasy']",tt0324572,6.6
ts7273,Doc McStuffins,SHOW,A young African-American girl aspires to be a doctor like her mom.,2012,TV-G,22,"['animation', 'family', 'fantasy', 'music']",tt1710295,6.6
tm72065,The Odd Life of Timothy Green,MOVIE,"A childless couple bury a box in their backyard, containing all of their wishes for an infant. Soon, a child is born, though Timothy Green is not all that he appears.",2012,PG,105,"['fantasy', 'drama', 'comedy', 'family']",tt1462769,6.6
tm344880,Jungle Cruise,MOVIE,"Dr. Lily Houghton enlists the aid of wisecracking skipper Frank Wolff to take her down the Amazon in his dilapidated boat. Together, they search for an ancient tree that holds the power to heal – a discovery that will change the future of medicine.",2021,PG-13,127,"['fantasy', 'action', 'comedy', 'family']",tt0870154,6.6
tm160651,Shipwrecked,MOVIE,A young Norwegian boy in 1850s England goes to work as a cabin boy and discovers some of his shipmates are actually pirates.,1990,PG,92,"['family', 'action', 'european']",tt0122085,6.6
ts21702,Iron Man,SHOW,Industrialist Tony Stark leads a private team of superheroes as Iron Man against the forces of evil.,1994,TV-Y7,22,"['action', 'scifi', 'family', 'animation']",tt0115218,6.6
tm961182,Expedition Everest,MOVIE,"Just inside Everest's notorious death zone, a team of climate scientists who specialize in extreme weather weigh their next move.",2020,PG,42,['documentation'],tt13009970,6.6
ts21656,The Proud Family,SHOW,"Follow the adventures and misadventures of Penny, a 14-year-old African American girl who's doing her best to navigate through the early years of teen-dom. Penny's every encounter inevitably spirals into bigger than life situations filled with hi-jinks, hilarity and heart. Her quest to balance her home, school and social lives are further complicated by friends like the sassy Dijonay, Penny's nemesis LaCienega Boulevardez, her loving, if not over-protective parents and her hip-to-the-groove-granny, Suga Mama.",2001,TV-Y,22,"['animation', 'comedy', 'family', 'fantasy']",tt0293737,6.5
tm57906,Ice Age: Continental Drift,MOVIE,"Manny, Diego, and Sid embark upon another adventure after their continent is set adrift. Using an iceberg as a ship, they encounter sea creatures and battle pirates as they explore a new world.",2012,PG,88,"['comedy', 'action', 'family', 'animation', 'drama', 'fantasy']",tt1667889,6.5
ts85083,LEGO Star Wars: All-Stars,SHOW,"An adventure series that spans all Star Wars eras featuring LEGO versions of the fresh faces of the Star Wars galaxy alongside iconic heroes including Kylo Ren, R2-D2, Young Han, Chewie, Young Lando, BB-8 and General Leia.",2018,TV-Y7,16,"['animation', 'action', 'comedy', 'scifi']",tt9297164,6.5
tm123092,Amy,MOVIE,A woman leaves her husband after the death of her child to teach deaf children how to speak. Her own child was deaf and although she has no formal training she successfully teaches one boy.,1981,G,100,"['drama', 'family']",tt0082017,6.5
tm184724,Diary of a Wimpy Kid: Rodrick Rules,MOVIE,"Wimpy Greg Heffley, now in seventh grade, thinks he has it all together. He has mastered middle school and gotten rid of the Cheese Touch. However, Greg's older brother, Rodrick, is itching to cut him down to size. He gets the perfect opportunity when their mother tries to force the boys to bond. Rodrick may be Greg's chief tormentor, but he feels his constant pranks are just what his little brother needs to prepare him for life's hard knocks.",2011,PG,99,"['comedy', 'family', 'animation']",tt1650043,6.5
