id,title,type,description,release_year,age_certification,runtime,genres,imdb_id,imdb_score
ts20539,The Super Hero Squad Show,SHOW,"The Super Hero Squad Show is an American cartoon series by Marvel Animation. It is based on the Marvel Super Hero Squad action figure line from Hasbro, which portray the Avengers, the X-Men, and various other characters of the Marvel Universe in a cartoonish super-deformed-style. It is also a self-aware parody of the Marvel characters, with influences taken from on the comedic Mini Marvels series of parody comic books, in that the heroes tend to find themselves in comedic situations, and have cartoonish bents in comparison to their usually serious personalities, and is an overall comedic take on the Avengers. The series' animation was produced by Film Roman and Marvel Animation.",2009,TV-Y7,23,"['action', 'comedy', 'family', 'scifi', 'animation']",tt1388589,5.9
tm145752,Eddie's Million Dollar Cook Off,MOVIE,"Eddie Ogden is his pa's pride and joy as well as the Groundhogs team's only asset as baseball talent. Then Eddie discovers a taste and talent for cuisine. Although his brothers Andy and Alex, and Pa as well as classmates enjoy his dishes, they only mock cooking, so he arranges and 'accidental' registration for him and two friends in Home Economics. Only Eddie -secretly again- and nerdy shrew Bridget Simons enter a national cooking competition for school-kids. Ma finds out and to his surprise proves supportive, as well as the teacher, who once won the competition herself.",2003,G,85,"['comedy', 'sport', 'family']",tt0365149,5.9
tm34558,Star Wars: The Clone Wars,MOVIE,"Set between Episode II and III, The Clone Wars is the first computer animated Star Wars film. Anakin and Obi Wan must find out who kidnapped Jabba the Hutt's son and return him safely. The Seperatists will try anything to stop them and ruin any chance of a diplomatic agreement between the Hutts and the Republic.",2008,PG,98,"['scifi', 'animation', 'action', 'family', 'fantasy']",tt1185834,5.9
tm124019,The Strongest Man in the World,MOVIE,"Medfield College science major Dexter Riley and his classmates have been working on a new vitamin compound when a lab accident creates a supercharged mix that ends up in Dexter's cereal box, giving him superhuman strength. The powerful formula comes to the attention of the college dean and two rival cereal companies, touching off a hilarious chain of events.",1975,G,92,"['comedy', 'scifi', 'family']",tt0073760,5.9
tm119103,Double Teamed,MOVIE,"Heather and Heidi play volleyball for their school team, when their family decides that they need to go to a bigger school so that they will have a better chance for scholarships. But at the new school, the twins are discovered by the basketball coach. Inspired by the true story of Heather and Heidi Burge.",2002,G,92,"['drama', 'family', 'sport']",tt0285528,5.9
tm1119960,Lost Tombs of the Pyramids,MOVIE,"In the shadow of the pyramids, an elite team of archaeologists embark on an extraordinary excavation. Could this secret site reveal startling new evidence about the great pharaohs who built these majestic monuments?",2020,PG,44,['documentation'],tt15545084,5.9
tm61627,The Thirteenth Year,MOVIE,A teen learns that his birth mother is a mermaid after he begins to grow fins and slimy scales on his thirteenth birthday.,1999,G,95,"['comedy', 'fantasy', 'family']",tt0200208,5.9
tm1123813,The Queen Family Singalong,MOVIE,"The Queen Family Singalong (Nov. 4, 2021) Copyright @ ABC With this special, one-night-only event, ABC is inviting friends and family from around the country to gather in their living rooms, crank up the volume and rock out for an hour of killer Queen hits, performed by musical artists the whole family knows and loves.",2021,,41,['music'],tt15716286,5.9
tm137900,Cheaper by the Dozen,MOVIE,"The Baker brood moves to Chicago after patriarch Tom gets a job coaching football at Northwestern University, forcing his writer wife, Mary, and the couple's 12 children to make a major adjustment. The transition works well until work demands pull the parents away from home, leaving the kids bored -- and increasingly mischievous.",2003,PG,98,"['comedy', 'family']",tt0349205,5.9
tm73079,The Black Hole,MOVIE,"The explorer craft USS Palomino is returning to Earth after a fruitless 18-month search for extra-terrestrial life when the crew comes upon a supposedly lost ship, the USS Cygnus, hovering near a black hole. The ship is controlled by Dr. Hans Reinhardt and his monstrous robot companion, but the initial wonderment and awe the Palomino crew feel for the ship and its resistance to the power of the black hole turn to horror as they uncover Reinhardt's plans.",1979,PG,98,"['scifi', 'action']",tt0078869,5.9
ts20635,Jessie,SHOW,"An idealistic teen from rural Texas embarks on the adventure of a lifetime when she decides to leave behind starry nights for big city lights. Thrilled to be on her own and determined not to be intimidated by New York City, she accepts a job as nanny for a high-profile couple with four kids. Helping to keep her moral compass in check are Bertram, the family's butler, and Tony, the building's 20-year-old doorman.",2011,TV-G,26,"['comedy', 'family', 'drama']",tt1865769,5.9
ts9795,Austin & Ally,SHOW,"A comedy about the unique relationship between a young songwriter, Ally Dawson, and Austin Moon, the overnight internet sensation who gains sudden notoriety after performing one of Ally's songs. Austin and Ally struggle with how to maintain and capitalize on Austin's newfound fame. Austin is more of a rebel type who doesn't follow the rules and is somewhat immature for his age, while Ally is conservative yet self-conscious.",2011,TV-G,23,"['family', 'music', 'romance', 'comedy', 'drama']",tt1830491,5.8
ts21235,The Replacements,SHOW,"Two orphans, Riley and little brother Todd, answer an ad for Fleemco Replacement People and order new parents, a spy mother and daredevil father. As Riley and Todd go on adventures (or misadventures as it were), they team up with Conrad Fleem to replace any adult in their lives that they don't like, but they don't get to choose the replacements and sometimes their good intentions don't work out as they planned",2007,TV-G,23,"['animation', 'comedy', 'family', 'scifi']",tt0816401,5.8
tm831100,Z-O-M-B-I-E-S 2,MOVIE,"The continuing adventures of Seabrook High students Addison and Zed, whose budding romance is threatened by the arrival of werewolves.",2020,,84,"['romance', 'comedy']",tt9766166,5.8
ts22091,My Friends Tigger & Pooh,SHOW,"Pooh, Tigger, and friends from the Hundred Acre Wood welcome new neighbors — an adorable six-year-old girl named Darby and her puppy, Buster. With the help of adventurous super sleuths Tigger and Pooh, every episode revolves around the solving of a mystery and an interactive curriculum that encourages viewers to help them out.",2007,TV-Y,24,"['action', 'animation', 'family']",tt0805905,5.8
tm112696,A Ring of Endless Light,MOVIE,"When 15-year-old Vicky Austin, her sister Suzy and little brother Rob visit their grandfather on Seven Bay Island, Vicky faces several unexpected challenges. Her beloved grandfather, retired Reverend Eaton, seems to be seriously ill, but tries to pretend that nothing is wrong. Vicky met the rich but emotionally troubled Zachary Gray the previous summer, and he reappears to renew the acquaintance. Another boy, 17-year-old Adam Eddington, recruits Vicky to help him with a research project, working with a dolphin called Basil. Vicky discovers she can communicate telepathically with the dolphin and his mate - and possibly with Adam as well",2002,,88,"['drama', 'romance', 'family']",tt0282123,5.8
tm69497,Snowglobe,MOVIE,"A young woman discovers a Christmas-themed dreamworld inside a magical snowglobe. Angela loves Christmas more than anything. However, her family does not share her love for the holiday at all. When she is about to breakdown because of her family, she receives a snowglobe in the mail. When she opens up the snowglobe, she is transported into the world inside, where Christmas is the heart and soul for everyone who lives there. She discovers she can return to her world by going down a small path in the small forest at the edge of the village, and can return whenever she winds up the snowglobe. After a long set of visits to the globe, she accidentally gets trapped inside.",2007,,120,"['scifi', 'fantasy', 'romance', 'comedy', 'family']",tt1068284,5.8
tm28759,Minutemen,MOVIE,"When three high-school friends invent a time-machine, they decide to use it to go back in time and prevent other youngsters from making humiliating mistakes.",2008,G,91,"['scifi', 'comedy', 'family', 'romance', 'thriller']",tt1072755,5.8
tm105016,Jack,MOVIE,"Jack Powell suffers from an affliction that makes him grow four times faster than normal, so the 10-year-old looks like a 40-year-old man. After years of being tutored at home, Jack convinces his overprotective parents to send him to public school. The children don't know what to make of Jack, but with the help of his fifth-grade teacher, he makes an effort to win them over.",1996,PG-13,113,"['comedy', 'drama', 'fantasy']",tt0116669,5.8
tm109381,Return to Never Land,MOVIE,"In 1940, the world is besieged by World War II. Wendy, all grown up, has two children; including Jane, who does not believe Wendy's stories about Peter Pan.",2002,G,72,"['fantasy', 'animation', 'family']",tt0280030,5.8
tm22701,Mom's Got a Date with a Vampire,MOVIE,"The Hansen kids are in a jam. Adam and his best friend Duffy have gotten their hands on some tickets for the Headless Horseman concert, and his sister Chelsea has a date with her dreamy boyfriend Peter. The only problem is they're both grounded. Chelsea and Adam will do whatever it takes to get their mom Lynette out of the house, even if it includes a chance meeting with a very mysterious man. Everything seems to go according to plan until their little brother Taylor realizes that this stranger might be a vampire.",2000,,85,"['fantasy', 'horror', 'comedy', 'family']",tt0250593,5.8
ts24939,Spider-Woman,SHOW,"When Jessica Drew was bitten by a poisonous spider as a child, her father saved her life by injecting her with an experimental ""spider serum,"" which also granted her superhuman powers. As an adult, Jessica works as editor of Justice Magazine but when trouble arises, Jessica slips away to change into her secret identity of Spider-Woman.",1979,TV-PG,21,"['animation', 'fantasy', 'action', 'family']",tt0197911,5.8
tm15129,Hacksaw,MOVIE,"A girl goes on vacation to the mountains where she finds a wild horse named Hacksaw. With a little help, she captures the stud and it doesn't take long until the man who helped her starts wagon racing, since Hacksaw refuses to have any man or woman on his back.",1971,PG,89,['family'],tt0067172,5.8
tm87512,The Shaggy D.A.,MOVIE,"Wilby Daniels, a successful lawyer running for District Attorney, suddenly finds himself being transformed into an English sheepdog. Somehow he has to keep his change a secret and find just what is causing it, all the while eluding the local dog catcher.",1976,G,91,"['fantasy', 'comedy', 'european', 'family']",tt0075200,5.8
tm308160,Gender Revolution: A Journey with Katie Couric,MOVIE,"Katie Couric travels across the U.S. to talk with scientists, psychologists, activists, authors and families about the complex issue of gender.",2017,PG,90,['documentation'],tt6844312,5.8
tm138383,Confessions of a Shopaholic,MOVIE,"In the glamorous world of New York City, Rebecca Bloomwood is a fun-loving girl who is really good at shopping-a little too good, perhaps. She dreams of working for her favorite fashion magazine, but can't quite get her foot in the door-until ironically, she snags a job as an advice columnist for a financial magazine published by the same company.",2009,PG,104,"['romance', 'comedy']",tt1093908,5.8
tm152094,The Biscuit Eater,MOVIE,"Nothing warms the heart like the story of a boy and his dog. Lonnie (Johnny Whitaker) and Text (George Spell) are two friends determined, against all odds, to turn a misfit hound into a hero. Tennessee farmer and dog trainer Harve McNeil (Earl Holliman) tells his son Lonnie that his dog, Moreover, is a good-for-nothing ""biscuit eater.""",1972,G,92,"['drama', 'family']",tt0068276,5.8
tm914379,Black Is King,MOVIE,"This visual album from Beyoncé reimagines the lessons of ""The Lion King"" (2019) for today’s young kings and queens in search of their own crowns.",2020,PG,85,"['music', 'drama', 'fantasy']",tt12607910,5.8
tm136528,Bad Hair Day,MOVIE,"The film is about a high school tech whiz (Laura Marano), who is determined to become prom queen. But on the big day, she suddenly wakes up having a bad hair day, and her destroyed prom dress, and everything that can go wrong, does go badly wrong. A police officer (Leigh-Allyn Baker) seeks the necklace that the teen somehow ends up possessing. Prom day goes really bad as the pair is pursued by a dogged jewel thief (Christian Campbell) on a wild ride cross around the city.",2015,,90,"['action', 'comedy', 'family']",tt3856042,5.8
ts35597,Best Friends Whenever,SHOW,"When their aspiring scientist friend Barry's invention goes awry, best friends Shelby and Cyd gain the power to leap forward and backward in time whenever they want – and sometimes when they don't. Now, they experience the twists and turns of friendship and must decide between fixing mistakes in the past or catching a glimpse of the future. While Barry and his assistant, Naldo, try to figure out how to replicate time travel for themselves, Cyd and Shelby use their newfound power to navigate high school life and Shelby's mischievous twin brothers, Bret and Chet.",2015,TV-G,24,"['scifi', 'comedy', 'family']",tt4507442,5.8
tm76049,Around the World in 80 Days,MOVIE,"A bet pits a British inventor, a Chinese thief and a French artist on a worldwide adventure that they can circle the globe in 80 days.",2004,PG,120,"['comedy', 'family', 'western', 'action']",tt0327437,5.8
tm136025,Strange Magic,MOVIE,"A love potion works its devious charms on fairies, elves and the swamp-dwelling Bog King as they all try to possess the potion for themselves.",2015,PG,99,"['fantasy', 'comedy', 'family', 'romance', 'animation']",tt4319336,5.8
tm88315,The Princess Diaries 2: Royal Engagement,MOVIE,"Mia Thermopolis is now a college graduate and on her way to Genovia to take up her duties as princess. Her best friend Lilly also joins her for the summer. Mia continues her 'princess lessons'- riding horses side-saddle, archery, and other royal. But her complicated life is turned upside down once again when she not only learns that she is to take the crown as queen earlier than expected...",2004,G,113,"['romance', 'comedy', 'family']",tt0368933,5.8
tm90273,Percy Jackson & the Olympians: The Lightning Thief,MOVIE,"Accident prone teenager, Percy discovers he's actually a demi-God, the son of Poseidon, and he is needed when Zeus' lightning is stolen. Percy must master his new found skills in order to prevent a war between the Gods that could devastate the entire world.",2010,PG,118,"['fantasy', 'family']",tt0814255,5.8
tm107673,The Castaway Cowboy,MOVIE,A Wayward Texas cowboy washes up on the beaches of Hawaii and is taken home by an fatherless boy. He saves the family's business while romancing the single mom.,1974,G,88,"['western', 'comedy', 'family']",tt0071288,5.8
tm978794,The Disney Holiday Singalong,MOVIE,"Returning for a third iteration, “The Disney Holiday Singalong” features more music and magic just in time for the holidays. The one-hour festive musical event includes star-studded performances, animated on-screen lyrics, more favorite Disney melodies and classic holiday songs.",2020,,45,"['comedy', 'family', 'music']",tt13392122,5.8
ts288962,Turning the Tables with Robin Roberts,SHOW,"Get personal with Robin Roberts and some of Hollywood’s groundbreaking women as they bear witness to their incredible journeys on their path to purpose. Each episode is a profound conversation filled with emotion and inspiration. Listen to never-before-heard stories of how these groundbreakers came face-to-face with their vulnerability, authenticity and intuition. Discover their commonalities and learn how their stories and experiences created room for expansion and evolution.",2021,,27,[],tt14598810,5.7
tm63063,Mighty Joe Young,MOVIE,"As a child living in Africa, Jill Young saw her mother killed while protecting wild gorillas from poachers led by Andrei Strasser. Now an adult, Jill cares for an orphaned gorilla named Joe -- who, due to a genetic anomaly, is 15 feet tall. When Gregg O'Hara arrives from California and sees the animal, he convinces Jill that Joe would be safest at his wildlife refuge. But Strasser follows them to the U.S., intent on capturing Joe for himself.",1998,PG,114,"['fantasy', 'family', 'thriller', 'action', 'european']",tt0120751,5.7
tm19463,The Ultimate Christmas Present,MOVIE,"A girl steals a weather machine from Santa Claus, to make a snow day. The machine breaks, and causes an out of control snowstorm.",2000,G,85,"['comedy', 'family']",tt0256466,5.7
ts220827,Spidey and His Amazing Friends,SHOW,"Follow Peter Parker, Gwen Stacy, and Miles Morales and their adventures as the young heroes team up with Hulk, Ms. Marvel, and Black Panther to take down foes like Rhino, Doc Oock, and Green Goblin.",2021,TV-Y7,24,"['comedy', 'family', 'fantasy', 'scifi', 'animation', 'action']",tt10862280,5.7
tm1695,101 Dalmatians,MOVIE,"An evil, high-fashion designer plots to steal Dalmatian puppies in order to make an extravagant fur coat, but instead creates an extravagant mess.",1996,G,103,"['comedy', 'crime', 'family']",tt0115433,5.7
ts330252,The Proud Family: Louder and Prouder,SHOW,"Follow the adventures and misadventures of newly 14-year-old Penny Proud and her family as they navigate modern life with hilarity and heart. The 2020s bring a new career for mom Trudy, wilder dreams for dad Oscar and new challenges for Penny, including a socially woke neighbor who thinks she has a lot to teach her.",2022,TV-PG,26,"['comedy', 'family', 'animation']",tt11871764,5.7
ts271634,Mickey Go Local,SHOW,"Mickey Go Local is a 2019 webcast animated series and also a locally-produced animated series exclusively for the Southeast Asian market. Though the episodes premiered on Disney Channel Asia's official YouTube channel, the series began airing on Disney Channel in Southeast Asia as interstitials.",2019,,3,"['comedy', 'animation']",tt13845582,5.7
tm959308,Secrets of the Bull Shark,MOVIE,We know Bull Sharks swim upriver and we know they hunt in the sea. But we've never been able to see it all like this. We see them attack and consume other sharks. We watch their shady hunts in the deep. We follow them up freshwater rivers to pupping grounds. We see them hunt shoals of fish from drones above and we watch as they clash with hippos and crocodiles.,2020,,44,['documentation'],tt13130602,5.7
tm19235,Stepsister from Planet Weird,MOVIE,Megan's world is turned upside down when she hears her calm life with her little brother and single mum is about to change. She hears she's soon to have a stepfather and a stepsister. Megan thinks they're a bit weird and is determined to stop the wedding. She discovers they're actually even stranger than she thought - they're from another planet.,2000,G,85,"['scifi', 'family', 'comedy']",tt0250754,5.7
tm179262,Chicken Little,MOVIE,"When the sky really is falling and sanity has flown the coop, who will rise to save the day? Together with his hysterical band of misfit friends, Chicken Little must hatch a plan to save the planet from alien invasion and prove that the world's biggest hero is a little chicken.",2005,G,81,"['comedy', 'family', 'fantasy', 'scifi', 'animation']",tt0491675,5.7
tm103181,You Again,MOVIE,"History -- make that high school -- may repeat itself when Marni learns that Joanna, the mean girl from her past, is set to be her sister-in-law. Before the wedding bells toll, Marni must show her brother that a tiger doesn't change its stripes. On Marni's side is her mother, while Joanna's backed by her wealthy aunt.",2010,PG,105,"['comedy', 'romance']",tt1414382,5.7
tm34566,Zenon: The Zequel,MOVIE,Zenon Kar is 15 and lives on a space station which the military has taken over and is dismantling. She receives a mysterious signal and must convince everyone that it's from aliens who have come to help them.,2001,G,100,"['scifi', 'comedy', 'family']",tt0271271,5.7
tm11266,The Million Dollar Duck,MOVIE,"Professor Dooley takes home a duck from his research laboratory as a toy for his son, but soon finds out that it lays golden eggs.",1971,G,89,"['comedy', 'family', 'scifi']",tt0066728,5.7
ts215481,Chip 'N' Dale: Park Life,SHOW,"The lovable chipmunk troublemakers in a non-verbal, classic style comedy, following the ups and downs of two little creatures living life in the big city.",2021,TV-G,22,"['comedy', 'family', 'animation']",tt10516496,5.7
tm88710,Gus,MOVIE,"The California Atoms are in last place with no hope of moving up. But by switching the mule from team mascot to team member, (He can kick 100 yard field goals!) they start winning, and move up in the rankings, Hurrah! The competition isn't so happy.",1976,G,96,"['comedy', 'family', 'sport']",tt0074599,5.7
tm166468,Planes,MOVIE,"Dusty is a cropdusting plane who dreams of competing in a famous aerial race. The problem? He is hopelessly afraid of heights. With the support of his mentor Skipper and a host of new friends, Dusty sets off to make his dreams come true.",2013,PG,91,"['family', 'action', 'comedy', 'animation', 'sport']",tt1691917,5.7
tm142670,Race to Witch Mountain,MOVIE,"A taxi driver gets more than he bargained for when he picks up two teen runaways. Not only does the pair possess supernatural powers, but they're also trying desperately to escape people who have made them their targets.",2009,PG,98,"['fantasy', 'thriller', 'action', 'family', 'scifi']",tt1075417,5.7
tm121010,The Santa Clause 2,MOVIE,"Better watch out! The big guy in red is coming to town once again. This time, Scott Calvin -- also known as Santa Claus -- finds out there's an obscure clause in his contract requiring him to take on a wife. He has to leave the North Pole to fulfill his obligations, or else he'll be forced to give up his Yuletide gig.",2002,G,104,"['comedy', 'fantasy', 'family']",tt0304669,5.7
tm53948,Morning Light,MOVIE,"Fifteen young sailors... six months of intense training... one chance at the brass ring. This documentary tells the story of a group of intrepid and determined young men and women, on the cusp of adulthood, as they embark on life's first great adventure. Racing a high-performance 52-foot sloop the crew of ""Morning Light"" matches wits and skills in a dramatic 2300 mile showdown.",2008,PG,98,"['documentation', 'sport', 'drama']",tt1198405,5.7
tm140455,Full-Court Miracle,MOVIE,"Full-Court Miracle is a 2003 Disney Channel Original Movie. It premiered on November 23, 2003. Inspired by the true story of University of Virginia basketball star Lamont Carr, the film centers on a group of young Jewish basketball players who search for a coach to help them out of a slump. The main character Alex Schlotsky is inspired by the true story of Alex Barbag and Chad Korpeck.",2003,,90,"['drama', 'family', 'sport']",tt0382142,5.7
tm96967,Avalon High,MOVIE,"Disney Channel's production of Julie Sherman Wolfe's screenplay adaptation of the popular novel Avalon High by Meg Cabot. Elaine ""Ellie"" Harrison has just moved from Minnesota to Annapolis, Maryland while her parents take a year long sabbatical to continue their medieval studies in nearby DC. Her new high school, Avalon High, seems like a typical high school with the stereotypical students: Lance the jock, Jennifer the cheerleader, Marco, the bad boy/desperado, and Will, the senior class president, quarterback, and all around good guy. But not everyone at Avalon High is who they appear to be, not even Ellie herself. Eventually, it becomes apparent that Avalon High is a situation where the ancient Arthurian legend is repeating itself. Will, Jennifer, Lance, Marco, and Mr. Morton all correspond to King Arthur, Queen Guinevere, Knight Lancelot, Mordred, and Merlin, respectively.",2011,G,91,"['fantasy', 'drama', 'family']",tt1614950,5.7
ts20581,Mickey Mouse Clubhouse,SHOW,"Mickey and his friends Minnie, Donald, Pluto, Daisy, Goofy, Pete, Clarabelle and more go on fun and educational adventures.",2006,TV-Y,27,"['animation', 'comedy', 'family', 'fantasy']",tt0784896,5.7
tm205517,The Ghosts of Buxley Hall,MOVIE,Ghosts and a young cadet try to save a military academy from being closed.,1980,,120,"['fantasy', 'horror', 'comedy', 'family']",tt0080788,5.7
ts293637,Disney's Magic Bake-Off,SHOW,"Splitting the kids between the ages of 6 and 14 into three teams of two, having them race against the clock to design a Disney-inspired cake, utilizing Tastemade's signature recipe videos and ""an enchanted pantry"" full of ingredient.",2021,TV-Y,46,"['family', 'reality']",tt14539670,5.7
ts96393,Marvel Super Hero Adventures,SHOW,"Spider-Man teams with other Marvel heroes, in this short-form series, to teach the benefits of friendship, co-operation and heroism.",2017,TV-Y,4,"['action', 'family', 'animation']",tt7726152,5.7
tm266656,Mulan,MOVIE,"When the Emperor of China issues a decree that one man per family must serve in the Imperial Chinese Army to defend the country from Huns, Hua Mulan, the eldest daughter of an honored warrior, steps in to take the place of her ailing father. She is spirited, determined and quick on her feet. Disguised as a man by the name of Hua Jun, she is tested every step of the way and must harness her innermost strength and embrace her true potential.",2020,PG-13,115,"['fantasy', 'drama', 'action', 'family']",tt4566758,5.7
