id,title,type,description,release_year,age_certification,runtime,genres,imdb_id,imdb_score
tm342433,Betty White Goes Wild,MOVIE,"Seven-time Emmy Award winner Betty White shares her love for animals and VIP backstage pass to three of America's top zoos and safari parks for a characteristically irreverent, intimate and unique tour of everything big cat.",2013,PG,44,['documentation'],tt3388100,7.4
ts52900,Big Hero 6 The Series,SHOW,"Picking up immediately following the events in the feature film, these are the continuing adventures and friendship of 14-year-old tech genius Hiro and his compassionate, cutting-edge robot Baymax. As the new prodigy at San Fransokyo Institute of Technology, Hiro now faces daunting academic challenges and the social trials of being the little man on campus. Off campus, the stakes are raised for the high-tech heroes as they must protect their city from an array of scientifically enhanced villains.",2017,TV-Y7,23,"['action', 'comedy', 'animation', 'scifi', 'family']",tt5515212,7.4
ts42258,LEGO Star Wars: The Freemaker Adventures,SHOW,"Set between The Empire Strikes Back and Return of the Jedi, The Freemaker Adventures centers on a family of three young siblings—young boy Rowan, his sister Kordi, and their brother Zander—known as the Freemakers, who salvage parts from destroyed or damaged ships which they use to build new ones, which they sell in order to make their living. They are accompanied by their salvaged battle droid Roger.",2016,TV-Y,22,"['animation', 'family', 'scifi', 'drama', 'fantasy', 'action', 'comedy']",tt5459566,7.4
ts300583,Pop Goes the Vet,SHOW,"If viewers have never seen a hairless rat with a pustule on its neck, or a plump fair pig with an abscess on its rump, they are in for a treat as some of National Geographic's most renowned and beloved vets work to drain some of the worst abscesses they have ever seen. From the office to the field, no pustule or abscess will go undrained.",2020,TV-PG,44,"['documentation', 'reality']",tt16763504,7.4
tm9048,Beauty and the Beast,MOVIE,"Follow the adventures of Belle, a bright young woman who finds herself in the castle of a prince who's been turned into a mysterious beast. With the help of the castle's enchanted staff, Belle soon learns the most important lesson of all -- that true beauty comes from within.",1991,G,84,"['fantasy', 'family', 'animation', 'scifi', 'drama', 'romance']",tt0101414,7.4
tm170139,Phineas and Ferb: The Movie: Across the 2nd Dimension,MOVIE,"Phineas and Ferb get trapped in an alternate dimension where the evil Doofenshmirtz rules the tri-state area. They must find a way back home with the help of their pet platypus named Perry, who they discover is a secret agent.",2011,,78,"['comedy', 'family', 'scifi', 'animation', 'action']",tt1825918,7.4
tm963702,The Last Ice,MOVIE,The Inuk people of the north are divided between modern and traditional lifestyles and Canadian and Danish political systems. Those divides are becoming more pronounced due to the effects of a warming northern climate.,2020,,83,['documentation'],tt12812506,7.4
ts189749,What If...?,SHOW,"Exploring pivotal moments from the Marvel Cinematic Universe and turning them on their head, leading the audience into uncharted territory.",2021,TV-14,32,"['action', 'scifi', 'fantasy', 'animation']",tt10168312,7.4
tm1172125,OLIVIA RODRIGO: driving home 2 u (a SOUR film),MOVIE,"Grammy® winner singer-songwriter Olivia Rodrigo takes a familiar road trip from Salt Lake City, where she began writing her debut album “SOUR,” to Los Angeles. Along the way, Rodrigo recounts the memories of writing and creating her record-breaking debut album and shares her feelings as a young woman navigating a specific time in her life. Through new live arrangements of her songs, intimate interviews and never-before-seen footage from the making of the album, audiences will follow Olivia along on a cinematic journey exploring the story of “SOUR.”",2022,PG-13,76,"['music', 'documentation']",tt18269838,7.4
tm160861,Wings of Life,MOVIE,"A beautiful love story in danger. Our future depends on an amazing love story between the flowers and fauna consisting of bees, butterflies, birds and bats, which allow these species to reproduce. Delicate and graceful, the flowers are not content to be the ultimate symbol of beauty. On the contrary, their vibrant colors and their exotic flavors are so many wonders that attract pollinators and drunk with desire. All these animals are involved in a complex dance of seduction on which one third of our crops, a dance without which we could survive ... Pollen presents the unsung heroes of the global food chain. Their fantastic worlds are full of stories, drama and beauty. While a fragile and threatened, essential for the balance of the planet, it should now actively protect ...",2011,G,77,"['documentation', 'family']",tt1222816,7.4
ts57135,Year Million,SHOW,"Explore what it will be like to be human one million years into the future. Today’s brightest futurists, scientists, scholars and notable science fiction writers guide viewers through the very latest advances in technology, ideas and innovations that likely will power the evolution of our species.",2017,TV-14,47,"['scifi', 'documentation', 'drama']",tt6945708,7.4
ts330309,Ice Age: Scrat Tales,SHOW,"Scrat experiences the ups and downs of fatherhood, as he and the adorable, mischievous Baby Scrat, alternately bond with each other and battle for ownership of the highly treasured Acorn.",2022,TV-PG,3,"['comedy', 'family', 'animation']",tt18302114,7.4
tm138110,"McFarland, USA",MOVIE,A track coach in a small California town transforms a team of athletes into championship contenders.,2015,PG,128,"['drama', 'sport']",tt2097298,7.4
tm181359,Frozen,MOVIE,"Young princess Anna of Arendelle dreams about finding true love at her sister Elsa’s coronation. Fate takes her on a dangerous journey in an attempt to end the eternal winter that has fallen over the kingdom. She's accompanied by ice delivery man Kristoff, his reindeer Sven, and snowman Olaf. On an adventure where she will find out what friendship, courage, family, and true love really means.",2013,PG,102,"['fantasy', 'comedy', 'family', 'animation']",tt2294629,7.4
tm9378,Mr. Holland's Opus,MOVIE,"In 1965, passionate musician Glenn Holland takes a day job as a high school music teacher, convinced it's just a small obstacle on the road to his true calling: writing a historic opus. As the decades roll by with the composition unwritten but generations of students inspired through his teaching, Holland must redefine his life's purpose.",1995,PG,137,"['drama', 'music']",tt0113862,7.3
tm79357,Bambi,MOVIE,"Bambi's tale unfolds from season to season as the young prince of the forest learns about life, love, and friends.",1942,G,70,"['animation', 'drama', 'family']",tt0034492,7.3
tm240625,Cruella,MOVIE,"In 1970s London amidst the punk rock revolution, a young grifter named Estella is determined to make a name for herself with her designs. She befriends a pair of young thieves who appreciate her appetite for mischief, and together they are able to build a life for themselves on the London streets. One day, Estella’s flair for fashion catches the eye of the Baroness von Hellman, a fashion legend who is devastatingly chic and terrifyingly haute. But their relationship sets in motion a course of events and revelations that will cause Estella to embrace her wicked side and become the raucous, fashionable and revenge-bent Cruella.",2021,PG-13,134,"['crime', 'comedy', 'drama']",tt3228774,7.3
ts213957,Mexico Untamed,SHOW,"Each of Mexico Untamed distinct colorful landscapes is characterised by the animals who live there. Charismatic travelers roam the oceans, forests and deserts, revealing drama and surprising behaviors. Predator and prey fight age-old battles for survival. Males and females of the most iconic species go to extreme measures to ensure the safe arrival of a new generation.",2018,,44,['documentation'],tt10389464,7.3
tm351023,Breaking2,MOVIE,"After six months of scientifically advanced training, three of the world's most elite distance runners set out to break the two-hour marathon barrier. These pioneers go on a global trek to defy the unthinkable and break the two-hour feat, from testing in wind tunnels and running labs in the United States, to balancing training with their day-to- day lives in eastern Africa, to the final heart-pounding race in Italy.",2017,PG,55,"['documentation', 'reality']",tt7816784,7.3
tm75152,The Simpsons Movie,MOVIE,"After Homer accidentally pollutes the town's water supply, Springfield is encased in a gigantic dome by the EPA and the Simpsons are declared fugitives.",2007,PG-13,87,"['family', 'animation', 'comedy', 'european']",tt0462538,7.3
tm166745,Prep & Landing: Naughty vs. Nice,MOVIE,"Lanny and Wayne are at it again! With the Big 2-5 fast approaching, Wayne and Lanny must race to recover classified North Pole technology which has fallen into the hands of a computer-hacking Naughty Kid! Desperate to prevent Christmas from descending into chaos, Wayne seeks out the foremost Naughty Kid expert to aid in the mission: a bombastic member of the Coal Bucket Brigade who also happens to be his estranged brother, Noel.",2011,G,22,"['animation', 'comedy', 'family', 'fantasy']",tt2069885,7.3
tm61052,Cinderella,MOVIE,"Cinderella has faith her dreams of a better life will come true. With help from her loyal mice friends and a wave of her Fairy Godmother's wand, Cinderella's rags are magically turned into a glorious gown and off she goes to the Royal Ball. But when the clock strikes midnight, the spell is broken, leaving a single glass slipper... the only key to the ultimate fairy-tale ending!",1950,G,74,"['fantasy', 'animation', 'family', 'romance']",tt0042332,7.3
ts37118,Marvel's The Defenders,SHOW,"Daredevil, Jessica Jones, Luke Cage and Iron Fist join forces to take on common enemies as a sinister conspiracy threatens New York City.",2017,TV-MA,50,"['scifi', 'action', 'crime', 'animation', 'comedy', 'fantasy']",tt4230076,7.3
ts55686,Andi Mack,SHOW,"Andi is contemplative and artistic and sheltered by overprotective parents. But on the eve of her 13th birthday, Andi's free-spirited older sister Bex returns home with a revelation that changes everything and sends Andi on an uncharted course of self-discovery.",2017,TV-G,25,"['drama', 'comedy', 'family']",tt5195114,7.3
tm44033,Tarzan,MOVIE,"Tarzan was a small orphan who was raised by an ape named Kala since he was a child. He believed that this was his family, but on an expedition Jane Porter is rescued by Tarzan. He then finds out that he's human. Now Tarzan must make the decision as to which family he should belong to...",1999,G,88,"['animation', 'comedy', 'drama', 'family', 'music', 'romance']",tt0120855,7.3
tm874,10 Things I Hate About You,MOVIE,"On the first day at his new school, Cameron instantly falls for Bianca, the gorgeous girl of his dreams. The only problem is that Bianca is forbidden to date until her ill-tempered, completely un-dateable older sister Kat goes out, too. In an attempt to solve his problem, Cameron singles out the only guy who could possibly be a match for Kat: a mysterious bad boy with a nasty reputation of his own.",1999,PG-13,97,"['drama', 'comedy', 'romance']",tt0147800,7.3
tm418,Black Panther,MOVIE,"King T'Challa returns home to the reclusive, technologically advanced African nation of Wakanda to serve as his country's new leader. However, T'Challa soon finds that he is challenged for the throne by factions within his own country as well as without. Using powers reserved to Wakandan kings, T'Challa assumes the Black Panther mantle to join with ex-girlfriend Nakia, the queen-mother, his princess-kid sister, members of the Dora Milaje (the Wakandan 'special forces') and an American secret agent, to prevent Wakanda from being dragged into a world war.",2018,PG-13,134,"['scifi', 'action']",tt1825683,7.3
ts82155,Big City Greens,SHOW,"The offbeat adventures of 10-year-old Cricket Green, a mischievous and optimistic country boy who moves to the big city with his wildly out of place family – older sister Tilly, father Bill and Gramma Alice.",2018,TV-Y7,18,"['comedy', 'family', 'animation']",tt7165904,7.3
tm186511,Monsters University,MOVIE,A look at the relationship between Mike and Sulley during their days at Monsters University — when they weren't necessarily the best of friends.,2013,G,104,"['animation', 'comedy', 'family', 'fantasy', 'horror']",tt1453405,7.3
tm138090,Monkey Kingdom,MOVIE,"A newborn monkey and its mother struggle to survive within the competitive social hierarchy of the Temple Troop, a dynamic group of monkeys who live in ancient ruins found deep in the storied jungles of South Asia.",2015,G,81,['documentation'],tt3660770,7.3
tm123374,Finding Dory,MOVIE,"Disney•Pixar's “Finding Dory” reunites everyone’s favorite forgetful blue tang, Dory, with her friends Nemo and Marlin on a search for answers about her past. What can she remember? Who are her parents? And where did she learn to speak Whale?",2016,PG,97,"['comedy', 'family', 'drama', 'animation']",tt2277860,7.3
tm191537,Hercules,MOVIE,"Bestowed with superhuman strength, a young mortal named Hercules sets out to prove himself a hero in the eyes of his father, the great god Zeus. Along with his friends Pegasus, a flying horse, and Phil, a personal trainer, Hercules is tricked by the hilarious, hotheaded villain Hades, who's plotting to take over Mount Olympus!",1997,G,93,"['fantasy', 'romance', 'animation', 'comedy', 'family', 'european', 'action']",tt0119282,7.3
tm160932,Bears,MOVIE,"Filmmakers Alastair Fothergill and Keith Scholey chronicle a year in the lives of an Alaskan brown bear named Sky and her cubs, Scout and Amber. Their saga begins as the bears emerge from hibernation at the end of winter. As time passes, the bear family must work together to find food and stay safe from other predators, especially other bears. Although their world is exciting, it is also risky, and the cubs' survival hinges on family togetherness.",2014,G,78,"['documentation', 'family']",tt2458776,7.3
tm150669,Marvel Studios: Assembling a Universe,MOVIE,"A look at the story behind Marvel Studios and the Marvel Cinematic Universe, featuring interviews and behind-the-scenes footage from all of the Marvel films, the Marvel One-Shots and ""Marvel's Agents of S.H.I.E.L.D.""",2014,PG,43,"['documentation', 'history']",tt3593022,7.3
tm417522,Raya and the Last Dragon,MOVIE,"Long ago, in the fantasy world of Kumandra, humans and dragons lived together in harmony. But when an evil force threatened the land, the dragons sacrificed themselves to save humanity. Now, 500 years later, that same evil has returned and it’s up to a lone warrior, Raya, to track down the legendary last dragon to restore the fractured land and its divided people.",2021,PG,107,"['fantasy', 'family', 'animation', 'action', 'comedy', 'drama']",tt10862682,7.3
tm105286,Peter Pan,MOVIE,"Leaving the safety of their nursery behind, Wendy, Michael and John follow Peter Pan to a magical world where childhood lasts forever. But while in Neverland, the kids must face Captain Hook and foil his attempts to get rid of Peter for good.",1953,G,77,"['fantasy', 'family', 'animation']",tt0046183,7.3
ts20008,Marvel's Luke Cage,SHOW,"Given superstrength and durability by a sabotaged experiment, a wrongly accused man escapes prison to become a superhero for hire.",2016,TV-MA,56,"['scifi', 'crime', 'drama', 'thriller', 'action']",tt3322314,7.3
tm124682,Old Yeller,MOVIE,"Young Travis Coates is left to take care of the family ranch with his mother and younger brother while his father goes off on a cattle drive in the 1860s. When a yellow mongrel comes for an uninvited stay with the family, Travis reluctantly adopts the dog.",1957,G,83,"['western', 'drama', 'family']",tt0050798,7.3
tm141020,Ant-Man,MOVIE,"Armed with the astonishing ability to shrink in scale but increase in strength, master thief Scott Lang must embrace his inner-hero and help his mentor, Doctor Hank Pym, protect the secret behind his spectacular Ant-Man suit from a new generation of towering threats. Against seemingly insurmountable obstacles, Pym and Lang must plan and pull off a heist that will save the world.",2015,PG-13,117,"['scifi', 'comedy', 'crime', 'action']",tt0478970,7.3
tm33681,Eight Below,MOVIE,"In the Antarctic, after an expedition with Dr. Davis McClaren, the sled dog trainer Jerry Shepherd has to leave the polar base with his colleagues due to the proximity of a heavy snow storm. He ties his dogs to be rescued after, but the mission is called-off and the dogs are left alone at their own fortune. For six months, Jerry tries to find a sponsor for a rescue mission.",2006,PG,120,"['drama', 'family']",tt0397313,7.3
tm141000,Avengers: Age of Ultron,MOVIE,"When Tony Stark tries to jumpstart a dormant peacekeeping program, things go awry and Earth’s Mightiest Heroes are put to the ultimate test as the fate of the planet hangs in the balance. As the villainous Ultron emerges, it is up to The Avengers to stop him from enacting his terrible plans, and soon uneasy alliances and unexpected action pave the way for an epic and unique global adventure.",2015,PG-13,141,"['scifi', 'action', 'comedy']",tt2395427,7.3
tm111159,Lady and the Tramp,MOVIE,"Lady, a golden cocker spaniel, meets up with a mongrel dog who calls himself the Tramp. He is obviously from the wrong side of town, but happenings at Lady's home make her decide to travel with him for a while.",1955,G,76,"['romance', 'drama', 'animation', 'comedy', 'family']",tt0048280,7.3
tm1016104,My Music Story: Yoshiki,MOVIE,"YOSHIKI independently performed Disney's masterpieces ""Let It Go-as it is-"" (from the movie ""Frozen"") and ""Can You Feel the Love Tonight"" (from the movie ""Lion King""). Arrange and play. In addition, valuable footage of the performances of ""Endless Rain,"" ""Without You,"" and ""River Of The Light,"" which he composed, as well as behind-the-scenes glimpses of recordings and arrangements performed at LA Hollywood studios, is also included.",2020,,47,"['documentation', 'music']",tt13925376,7.3
tm460582,Into the Grand Canyon,MOVIE,"Two journalists traverse the Grand Canyon by foot, hoping this 750-mile walk will help them better
 understand one of America's most revered landscapes and the threats poised to alter it forever.",2019,PG,84,['documentation'],tt9822474,7.3
tm114448,Lilo & Stitch,MOVIE,"As Stitch, a runaway genetic experiment from a faraway planet, wreaks havoc on the Hawaiian Islands, he becomes the mischievous adopted alien ""puppy"" of an independent little girl named Lilo and learns about loyalty, friendship, and 'ohana, the Hawaiian tradition of family.",2002,PG,85,"['animation', 'comedy', 'drama', 'family', 'fantasy', 'scifi']",tt0275847,7.3
ts220233,One Day at Disney,SHOW,Discover what it’s like to report to work every day for The Walt Disney Company. Step behind the scenes to immerse yourself in one “ordinary” day at Disney.,2019,TV-PG,6,['documentation'],tt10854760,7.3
tm90286,Secrets of Life,MOVIE,"A feature-length documentary showing the changing world of nature, the sky, the sea, the sun, planets, insects and volcanic action. A story of nature's strange and intricate designs for survival and her many methods of perpetuating life.",1956,G,70,"['documentation', 'family']",tt0049733,7.3
tm31764,Pirates of the Caribbean: Dead Man's Chest,MOVIE,Captain Jack Sparrow works his way out of a blood debt with the ghostly Davy Jones to avoid eternal damnation.,2006,PG-13,151,"['fantasy', 'action']",tt0383574,7.3
tm52052,The Crimson Wing: Mystery of the Flamingos,MOVIE,"In the remote and forgotten wilderness of Lake Natron, in northern Tanzania, one of nature's last great mysteries unfolds: the birth, life and death of a million crimson-winged flamingos.",2008,G,78,['documentation'],tt0902967,7.3
tm19764,The Vanishing Prairie,MOVIE,Story of the American Prairie as it was when vast herds of bison and elk grazed.,1954,G,71,"['documentation', 'family']",tt0047642,7.3
ts256051,Inside Pixar,SHOW,"This documentary series of personal and cinematic stories that provide an inside look into the people, artistry, and culture of Pixar Animation Studios.",2020,TV-G,11,"['documentation', 'family']",tt13302848,7.3
tm54168,One Hundred and One Dalmatians,MOVIE,"When a litter of dalmatian puppies are abducted by the minions of Cruella De Vil, the parents must find them before she uses them for a diabolical fashion statement.
 In a Disney animation classic, Dalmatian Pongo is tired of his bachelor-dog life. He spies lovely Perdita and maneuvers his master, Roger, into meeting Perdita's owner, Anita. The owners fall in love and marry, keeping Pongo and Perdita together too. After Perdita gives birth to a litter of 15 puppies, Anita's old school friend Cruella De Vil wants to buy them all. Roger declines her offer, so Cruella hires the criminal Badun brothers to steal them -- so she can have a fur coat.",1961,G,79,"['comedy', 'family', 'animation']",tt0055254,7.3
tm111322,The African Lion,MOVIE,"Part of Disney's True-Life Adventures series, this film focuses on the lives of lions in Africa.",1955,G,75,"['documentation', 'family']",tt0047803,7.2
tm349784,Christopher Robin,MOVIE,"Christopher Robin, the boy who had countless adventures in the Hundred Acre Wood, has grown up and lost his way. Now it’s up to his spirited and loveable stuffed animals, Winnie The Pooh, Tigger, Piglet, and the rest of the gang, to rekindle their friendship and remind him of endless days of childlike wonder and make-believe, when doing nothing was the very best something.",2018,PG,104,"['fantasy', 'animation', 'comedy', 'drama', 'family']",tt4575576,7.2
tm35022,Glory Road,MOVIE,"In 1966, Texas Western coach Don Haskins led the first all-black starting line-up for a college basketball team to the NCAA national championship.",2006,PG,118,"['history', 'drama', 'sport']",tt0839835,7.2
ts36167,Marvel's Guardians of the Galaxy,SHOW,"Peter Quill is Star-Lord, the brash adventurer who, to save the universe from its greatest threats, joins forces with a quartet of disparate misfits — fan-favorite Rocket Raccoon, a tree-like humanoid named Groot, the enigmatic, expert fighter Gamora and the rough edged warrior Drax the Destroyer.",2015,TV-Y7,22,"['action', 'comedy', 'drama', 'family', 'scifi', 'animation']",tt17461610,7.2
ts171975,Birth of Europe,SHOW,"Crushed, flooded and exploded into life – Europe is a battlefield of Nature. Discover the extraordinary and shocking geological story of how Europe was created by nature’s most titanic forces.",2012,,50,['documentation'],tt2125050,7.2
tm1151565,Explorer: The Last Tepui,MOVIE,Follows elite climber Alex Honnold and a world-class climbing team led by National Geographic Explorer and climber Mark Synnott on a grueling mission deep in the Amazon jungle as they attempt a first-ascent climb up a 1000 foot sheer cliff.,2022,,55,['documentation'],tt17048366,7.2
tm87946,Dumbo,MOVIE,"Dumbo is a baby elephant born with over-sized ears and a supreme lack of confidence. But thanks to his even more diminutive buddy Timothy the Mouse,  the pint-sized pachyderm learns to surmount all obstacles.",1941,G,63,"['animation', 'drama', 'family', 'fantasy']",tt0033563,7.2
tm151689,The Book of Life,MOVIE,"The journey of Manolo, a young man who is torn between fulfilling the expectations of his family and following his heart. Before choosing which path to follow, he embarks on an incredible adventure that spans three fantastical worlds where he must face his greatest fears.",2014,PG,95,"['comedy', 'fantasy', 'romance', 'animation', 'family']",tt2262227,7.2
tm47587,Willow,MOVIE,"The evil Queen Bavmorda hunts the newborn princess Elora Danan, a child prophesied to bring about her downfall. When the royal infant is found by Willow, a timid farmer and aspiring sorcerer, he's entrusted with delivering her from evil.",1988,PG,126,"['fantasy', 'romance', 'action', 'drama']",tt0096446,7.2
tm327660,Growing Up Wild,MOVIE,"Life is an adventure - especially for a newborn animal who has so much to learn. ""Growing Up Wild"" takes audiences to the wildest corners of the planet to tell the tales of five courageous animals as they tackle the very first challenges of their young lives. With a little guidance from sage family members, each must figure out how and where to find food, while learning to recognize the very real threat of danger. From their first steps of exploring their world to their final steps into independence, ""Growing Up Wild"" reveals the triumphs and setbacks of five young lives in which instinct, parental lessons, and trial & error ultimately define their destinies. Featuring the stunning imagery and iconic storytelling that makes Disneynature's big-screen adventures an inspiring movie-going experience, ""Growing Up Wild"", brings home a special look at how similar and different these young lives can be.  - Written by (C) 2016 Disney Enterprises",2016,G,77,['documentation'],tt6332994,7.2
ts20394,Kim Possible,SHOW,"If there's danger or trouble, Kim Possible is there on the double to save the world from villains... and still make it home in time for cheerleading practice! Luckily, Kim has her sidekick Ron Stoppable and his pet naked mole-rat Rufus by her side.",2002,TV-G,21,"['action', 'comedy', 'scifi', 'animation', 'family', 'romance']",tt0278866,7.2
tm220989,Born in China,MOVIE,"Venturing into the wilds of China, ""Born in China"" captures intimate moments with a panda bear and her growing cub, a young golden monkey who feels displaced by his baby sister, and a mother snow leopard struggling to raise her two cubs.",2016,G,76,['documentation'],tt4629266,7.2
